{
  "approvalId": "approval-rxscan-core-2.0.0@2026.07.26.1+d35c90695409",
  "approvedAt": "2026-07-26T02:20:27Z",
  "approvers": {
    "data": "Mathieu Fortin — RxScan Technologies",
    "guide": "Mathieu Fortin — RxScan Technologies",
    "paramedic": "Mathieu Fortin — RxScan Technologies"
  },
  "comparison": {
    "baselineReleaseId": "rxscan-core-1.9.0@2026.07.23.1+3807ce05689a",
    "status": "compatible"
  },
  "consumerTests": {
    "guide": "passed",
    "paramedic": "passed"
  },
  "manifestSha256": "005fda57155a81e0f1e130e885fadd9a125956ae043ee6c6bd6778cf5030562d",
  "releaseId": "rxscan-core-2.0.0@2026.07.26.1+d35c90695409",
  "schemaVersion": "1.0.0",
  "warningDispositions": []
}
